Company,Title,Location,Publish Time,Salary,Work Model,Match Score,Applicants,Min YOE,H1B Sponsor,Matched Skills,Missing Skills,URL,Apply Link
Cresta,"Senior/Staff Backend Engineer (AI Agent), Remote",United States,2 hours ago,$190K/yr - $300K/yr,Remote,89.4234,200,4,True,"Cloud services, API design, Containerization Kubernetes, Containerization Docker, Cloud environments Azure","Backend system architecture, Database optimization, Cloud environments AWS, Cloud environments Google Cloud",https://jobright.ai/jobs/info/b2b_1769670052353_604,https://jobright.ai/jobs/info/b2b_1769670052353_604
Uber,Senior Software Engineer - Middleware - AV Labs,"Sunnyvale, California, United States",12 minutes ago,$202K/yr - $224K/yr,Onsite,96.3092,31,3,True,"Python, C++, Linux",Robot Operating System,https://jobright.ai/jobs/info/69f7db800b36ff035475843a,https://www.uber.com/careers/list/159127
SMBC Group,Application Developer,"Charlotte, NC",8 hours ago,N/A,Hybrid,98.0,200,2,True,"Java, React.js, Object-oriented programming, RESTful APIs, Microservices architecture, JavaScript, TypeScript, HTML5, CSS, Azure cloud services, Databases, Git, CI/CD, Docker, Kubernetes","Full stack development, Agile methodologies",https://jobright.ai/jobs/info/6969aec1639b452fb57f9ec4,https://careers.smbcgroup.com/smbc/job/Charlotte-Application-Developer-NC-28202/1356833300/?feedId=391600&utm_source=LinkedInJobPostings&utm_campaign=SMBC_LinkedIn&mode=job&iis=SOURCE&iisn=LINKEDIN
Vectra AI,Senior Data Platform Engineer,"Austin, TX",1 hour ago,$150K/yr - $180K/yr,Onsite,89.6519,51,2,True,"Software development, Real time data processing, Databases, Data management, Object oriented programming, Python, Data structures, Algorithms, Unix/Linux, Source control, Git, Containerization, Docker, Kubernetes, Cloud providers, AWS, Debugging",Data production platforms,https://jobright.ai/jobs/info/69f510c812f2811ab5a62c38,https://boards.greenhouse.io/embed/job_app?token=7815917&utm_source=jobright
Cetera Financial Group,Senior Software Engineer,"Dallas, TX",9 hours ago,$122K/yr - $157K/yr,Hybrid,98.0,141,5,True,"Python, Agentic AI frameworks, AWS SageMaker, AWS Lambda, AWS services, RESTful APIs, Microservices, Software design patterns","AWS Bedrock, Microsoft technology stack, Analytical skills",https://jobright.ai/jobs/info/69bdd04ab106024562830fb0,https://ebhu.fa.us2.oraclecloud.com/hcmUI/CandidateExperience/en/job/6201/?utm_medium=jobshare
Klaviyo,Software Engineer II - WhatsApp,"Boston, MA",12 hours ago,$116K/yr - $174K/yr,Onsite,84.8053,200,3,True,"Software Engineering, Code Review, Testing Practices, Python, React, Machine Learning Concepts, Cloud-native Solutions, AWS","Full Stack Development, Front-end Technologies, Back-end Technologies, Agile Methodologies, Digital Marketing Software, Customer Data Software",https://jobright.ai/jobs/info/69a135086b458d060735f0fc,https://www.klaviyo.com/careers/jobs?gh_jid=7646546003&gh_src=1284ec8c3us
Qualcomm,Agentic AI Benchmarking and Evaluation Engineer,"San Diego, CA",10 hours ago,$123K/yr - $184K/yr,Onsite,92.7288,200,2,True,"Software development, Debugging, Machine learning fundamentals, Generative AI, Large language models, Neural network architectures, PyTorch, Python, AI agent frameworks","TensorFlow, Hardware acceleration optimization, Embedded systems",https://jobright.ai/jobs/info/69f74496a3d34b4f76f5b087,https://careers.qualcomm.com/careers/job/446715596289?hl=en-US&utm_source=linkedin&domain=qualcomm.com&source=APPLICANT_SOURCE-6-2
Chime,"Mobile Full-Stack Engineer, Multiplayer","San Francisco, CA",11 hours ago,$133K/yr - $184K/yr,Hybrid,85.709,200,3,True,"API development, Web development - React, Mobile development - React Native, Performance optimization, Testing, Deployment, Growth mindset","Full-stack software development, Backend services development, Service-based architecture, Scalable systems, Reliability engineering",https://jobright.ai/jobs/info/69c35dae94007a2195dfc82d,https://boards.greenhouse.io/chime/jobs/8457578002?gh_jid=8457578002&gh_src=35f490fd2&source=LinkedIn
JPMorganChase,Software Engineer III - Python/AWS/Kafka,"Jersey City, NJ",12 hours ago,$133K/yr - $185K/yr,Onsite,98.0,83,3,True,"Python, AWS Cloud services, AWS Lambda, AWS API Gateway, AWS DynamoDB, AWS S3, SQL databases, RESTful APIs, Microservices, Docker, Git, CI/CD","AWS RDS, AWS SQS, AWS SNS, AWS CloudWatch",https://jobright.ai/jobs/info/69f72a11db88714bcdfb81cb,https://JPMorganChase.contacthr.com/151951088
Iru,"Senior Software Engineer, Full Stack, Iru AI","Miami, FL",10 hours ago,N/A,Hybrid,88.3035,115,3,True,"Frontend frameworks - React, AI/LLM integration, Prompt engineering, AI agents development, RESTful API design, Cloud platforms - AWS, Microservices patterns, Event-driven architecture, Docker, Container orchestration - Kubernetes, Unit testing, Integration testing, CI/CD pipelines","Backend programming - Python, Backend programming - Go, Backend programming - Java, Frontend frameworks - TypeScript, AI tool orchestration, Agent-based systems, GRPC services, Cloud platforms - GCP, Service-oriented architecture, Message brokers - Kafka, Message brokers - RabbitMQ, Container orchestration - ECS, Database modeling",https://jobright.ai/jobs/info/69bdd520b1060245628323f0,https://jobs.lever.co/iru/8b92176d-9be2-47f9-9785-0e92db48a69d/apply?source=LinkedIn
Chainguard,Software Engineer (Libraries Platform),United States,3 hours ago,$120K/yr - $140K/yr,Remote,82.7095,69,3,True,"CI/CD, Cloud-native infrastructure, Containers Docker/OCI, Containers Kubernetes, Public cloud Azure, Terraform, GitHub Actions, Performance tuning","Go (Golang), Infrastructure for language ecosystems, Developer tooling, Automation, Public cloud GCP, Public cloud AWS, Argo, Tekton, Reliability engineering (SRE)",https://jobright.ai/jobs/info/69e17de2fd1c0456f3fae8cc,https://boards.greenhouse.io/embed/job_app?token=4673133006&utm_source=jobright
Quantifi,AI Engineer,"New York, New York",16 hours ago,$180K/yr - $200K/yr,Onsite,92.305,32,3,True,"Python, TypeScript, Node.js, AI/ML fundamentals, Large Language Models (LLMs), AI agents development, Deployment, Data pipelines, Prompt engineering","Retrieval systems, Backend infrastructure for AI applications, Distributed systems concepts, Agent orchestration, Intelligent routing logic",https://jobright.ai/jobs/info/69f757a3a3d34b4f76f5b635,https://quantifisolutions.freshteam.com/jobs/_BdrQBi1EkVS/ai-engineer
SS&C Technologies,Software Engineer,"San Francisco, CA",9 hours ago,N/A,Hybrid,83.2259,200,3,True,"Java, REST APIs, Relational Databases, NoSQL Databases, Computer Science Fundamentals, Containers, Container Orchestration","Spring Framework, Software Architecture, C#, .NET Development, Messaging Systems, Agile, Scrum",https://jobright.ai/jobs/info/69ec79840a6e09555304e2f8,https://www.linkedin.com/jobs/view/4335758975
Uber,Software Engineer II - Grocery & Retail,"New York, NY",19 hours ago,N/A,Onsite,93.9976,54,2,True,"Java, C++, Python, Microservices architecture, Code review, Unit testing, Integration testing, Algorithm development, Data structures","Go, Backend development, Distributed systems, Complexity analysis",https://jobright.ai/jobs/info/69f6f0f3582f810f9c8ca9c1,https://tnl2.jometer.com/v2/job?jz=5wqzs98ab76aa9adf43be743ca79443f70821KMAGUCAAAABQ&iis=Job%20Board%20-%20Recruitment%20Marketing&iisn=LinkedIn
Two Sigma,AI Research Scientist - Campus Full-Time,"New York, United States",8 hours ago,$200K/yr - $220K/yr,Hybrid,91.9618,200,N/A,True,"Machine Learning, Deep Learning, Large Language Models, Reinforcement Learning, Python, PyTorch, Cloud Environments, Version Control Systems, Regression Testing, Unit Testing, Code Reviews","TensorFlow, JAX, Multi-machine CPU/GPU setups, Profiling",https://jobright.ai/jobs/info/696880d3f25a38006696f529,https://careers.twosigma.com/careers/JobDetail/New-York-New-York-United-States-AI-Research-Scientist-Campus-Full-Time/13671?source=LinkedIn
Glimpse,Software Engineer,"New York, NY",11 hours ago,$130K/yr - $200K/yr,Onsite,95.5198,200,3,True,"Python, Node.js, Large Language Models (LLMs), MongoDB, PostgreSQL, Team-oriented attitude","Full-stack development, Next.js",https://jobright.ai/jobs/info/69bd8c254828227293ffc822,https://jobs.ashbyhq.com/glimpse/767a3a59-53d6-4306-afae-6b05a265ba82/application?utm_source=4M0PNbwNk7&src=linkedin
ŌURA,iOS Engineer,United States,9 hours ago,$142K/yr - $178K/yr,Remote,78.3926,200,3,True,"Git, Code review workflows, Unit testing, Manual testing, Computer science fundamentals, Design patterns","IOS app development, Swift, IOS app architectures, Third-party iOS libraries, Frameworks, Collaborative development",https://jobright.ai/jobs/info/68dd95e7ddc10244dd681463,https://job-boards.greenhouse.io/oura/jobs/4024449009?gh_src=lbbc4gkk9us
Harvey,"Software Engineer, Developer Experience (DevEx)","San Francisco, CA",9 hours ago,$175K/yr - $250K/yr,Onsite,86.8508,200,3,True,"Software Engineering, Python, CI/CD Systems, Test Frameworks, Container Technologies, AI Integration","Backend Development, Distributed Systems, Load, Performance Testing, Infrastructure as Code",https://jobright.ai/jobs/info/6969ac07639b452fb57f9c5e,https://jobs.ashbyhq.com/harvey/823658d8-21ae-46e5-ac93-1454e6527c63?utm_source=58AzKxpoq0
CommerceIQ,Software Engineer,"Mountain View, California, United States",21 hours ago,$140K/yr - $170K/yr,Onsite,89.5817,49,2,True,"Java, Python, AI tools, Cloud services, Microservices, CI/CD","Backend development, Full-stack development, Eagerness to learn",https://jobright.ai/jobs/info/69e16ad9fd1c0456f3fae386,https://boards.greenhouse.io/embed/job_app?token=7703493003&utm_source=jobright
Microsoft,Senior Software Engineer,"Redmond, WA",10 hours ago,$120K/yr - $235K/yr,Onsite,88.7345,25,4,True,"C, C++, Java, JavaScript, Python, Recommendation Systems, Large Language Models, Multimodal AI, AI-driven Reasoning Systems, Image Processing, Computer Vision","C#, Search Systems, Information Retrieval, Evaluation Frameworks, Experimentation Approaches, Quality Metrics, Content Understanding, Product Intuition",https://jobright.ai/jobs/info/69f74ccea3d34b4f76f5b268,https://apply.careers.microsoft.com/careers/job/1970393556851579?utm_source=linkedin&domain=microsoft.com&src=LinkedIn
GEM,Software Developer,"Charlotte, NC",23 hours ago,N/A,Hybrid,85.9207,52,N/A,True,"Angular, Azure, GitHub, SQL, Python, Software Development, ETL","UX/UI Design, AI-enabled Development Tools, Financial Services Software, Data Warehouse, Portfolio/Risk Modeling, Stakeholder Management",https://jobright.ai/jobs/info/69f69a9bb1fc847fc1ae40ec,https://globalendowment.hrmdirect.com/employment/job-opening.php?req=3652891&req_loc=1241171&&
NiCE,Software Engineer - AI Coding Agents,"Sandy, UT",12 hours ago,N/A,Onsite,89.5229,200,N/A,True,"Typescript, Python, Cloud environments, APIs, Microservices, Event-driven systems, AI/ML concepts, Large language models, AI SDKs, AWS, Azure, CI/CD, Docker, Kubernetes, Work in a fast-paced environment","Backend development, C#, NET, Rust, Scalable distributed systems, GCP, Analytical skills",https://jobright.ai/jobs/info/69bdc8104828227293004025,https://boards.eu.greenhouse.io/nice/jobs/4818465101?gh_jid=4818465101
Atlantic Group,Application Developer,"Greenwich, CT",5 hours ago,N/A,Onsite,94.3187,25,N/A,True,"TypeScript, Angular, React, Containerization, CI/CD tools, Python, Software design principles, System design, Cloud-based environments, AWS, Azure, Relational databases, MSSQL, PostgreSQL, SQL","C#, .NET, Service-to-service communication, Buy Side Financial Firm experience",https://jobright.ai/jobs/info/69f7cb4da3d34b4f76f5bd24,https://www.linkedin.com/jobs/view/4409883453
Venture Global LNG,Data Engineer,"Arlington, VA",10 hours ago,N/A,Onsite,90.1512,200,2,True,"Cloud Architecture, Data Engineering, Azure, Data Processing, Data Integration, Parallel Processing, SQL, Python, Azure Data Factory, Azure Databricks, Data Pipeline Development","Data Storage Solutions, Data Architecture, Spark, Self-management, Prioritization",https://jobright.ai/jobs/info/69a0defc81476f6176bb318d,https://boards.greenhouse.io/embed/job_app?token=8182349002&utm_source=jobright
Old Mission,Front End Software Engineer,"Chicago, IL, United States",7 hours ago,$125K/yr - $225K/yr,Onsite,92.9972,25,5,True,"React, JavaScript frameworks, TypeScript, Redux, Websockets, Protocol Buffers, Linux, Postgres, Team player mentality","Jest, Webpack, Frontend development, Automated testing, User feedback gathering",https://jobright.ai/jobs/info/69caa730e565c26a7003f40a,https://boards.greenhouse.io/embed/job_app?token=6549687003&utm_source=jobright
Amplify,Senior Software Engineer,United States,12 hours ago,$140K/yr - $160K/yr,Remote,97.6996,200,3,True,"Software development, React, Server-side development, Node.js, MongoDB, AWS, Azure, Software design, AI integration, TypeScript, Self-driven learning","Frontend frameworks, Database technologies, Cloud deployment, GCP, Automated testing",https://jobright.ai/jobs/info/69320087fa28370be26c07bc,https://amplify.wd1.myworkdayjobs.com/Amplify_Careers/job/Remote---United-States/Senior-Software-Engineer_Req_12357-1?source=LinkedIn
VAST Data,Top Graduate Software Engineer - V-Force - New York,"NY, New York, US",9 hours ago,N/A,Hybrid,98.0,37,N/A,True,"Programming languages - C, Programming languages - C++, Programming languages - Python, Data structures, Algorithms, English communication",Code documentation,https://jobright.ai/jobs/info/69f757cb81706a5bd216bdbe,https://www.comeet.com/jobs/vastdata/43.001/top-graduate-software-engineer---v-force---new-york/B7.765
Quality Theorem,Data Engineer,"Redmond, WA",7 hours ago,N/A,Onsite,82.0604,66,3,True,"Data Engineering, Database Administration, PostgreSQL, MongoDB, SQL, AWS Database Services, Python, Scripting Language, MongoDB Replica Sets, MongoDB Sharding, MongoDB Indexing, PostgreSQL Replication, PostgreSQL Performance Tuning, PostgreSQL Connection Pooling, MongoDB Atlas, Database Security","Amazon Redshift, AWS Data Services, Workflow Orchestration Tools, Airflow, Step Functions, MongoDB Backups, Redshift Cluster Management, Redshift Query Tuning, Redshift Workload Management, Redshift Snapshots, Monitoring Tools, CloudWatch, PgBadger, Encryption",https://jobright.ai/jobs/info/69f77add582f810f9c8cc03f,https://www.linkedin.com/jobs/view/4409867477
Cloudflare,"Software Engineer, Global Resource Management","Austin, TX",11 hours ago,N/A,Hybrid,91.323,200,3,True,"Software Development, Systems Design, Code Review","Distributed Systems, Go (Golang), Architectural Thinking",https://jobright.ai/jobs/info/69ace3342747003c3d5275d4,https://boards.greenhouse.io/cloudflare/jobs/7340134?gh_jid=7340134&gh_src=5ylsd31&source=LinkedIn
Axle,Senior Full Stack Developer,"Rockville, MD",8 hours ago,$120K/yr - $145K/yr,Onsite,97.3068,25,3,True,"TypeScript, JavaScript, Jupyter notebooks, Node.js, Angular 19+, NoSQL databases, MongoDB, Containers, Docker, Container orchestration, Kubernetes, GitHub Actions, Version control systems, Git, Unit testing, Generative AI technologies","Full-stack development, DevOps tools, Jenkins, End-to-end testing",https://jobright.ai/jobs/info/69a1f6fd0da45516f16b408c,https://www.linkedin.com/jobs/view/4377936490
"Yaskawa America, Inc. -  Drives & Motion Division",Software Engineer C,"Franklin, WI",9 hours ago,N/A,Hybrid,97.0067,200,1,True,"Programming languages, C++, SQL, Python, Software development lifecycle, Coding practices",Agile methodologies,https://jobright.ai/jobs/info/69eb12b5dc35f7132c4ad420,https://recruiting.ultipro.com/YAS1000YAAMI/JobBoard/8a2317d2-a61e-4259-a857-722d164a211c/OpportunityDetail?opportunityId=9abb3111-f9c9-460a-a35b-ecbd9a306243&source=LinkedIn&utm_source=LINKEDIN
Lead,Software Engineer II,San Francisco Bay Area,8 hours ago,$150K/yr - $175K/yr,Hybrid,81.859,200,2,True,"Large scale backend systems, AWS, Java, High quality code base development","Cloud native environment, Go, Project delivery, Curiosity, Humility, Openness to learning",https://jobright.ai/jobs/info/695a690c9f1b381eb27302a1,https://jobs.ashbyhq.com/leadbank/665bd580-a7b4-412e-bc47-cfb52a5787dd?utm_source=LinkedIn
Hub Group,Associate Full Stack Developer,"Oak Brook, IL",6 hours ago,$85K/yr - $85K/yr,Onsite,86.2326,200,2,True,"NodeJS, AngularJS, RESTful APIs, Web Services, JavaScript, SQL, HTML, CSS, NoSQL Database, Unit testing, Integration testing, Source revision control, GIT","MEAN stack, Spring MVC, JAX-WS, LESS, SASS, Bootstrap, Cross-compilation, Bug tracking, JIRA, JTAG debuggers, Open-Source technologies",https://jobright.ai/jobs/info/6946b2e4d1953b5d11bfe12a,https://www.linkedin.com/jobs/view/4326557735
Grafana Labs,Software Engineer - Platform Productivity | USA | Remote,United States,10 hours ago,$128K/yr - $153K/yr,Remote,82.6,25,N/A,True,"Go programming, Kubernetes, Docker, Terraform, CI/CD platform management, Release automation, Software development, Observability systems","Infrastructure as Code, Crossplane, Build automation, Application configuration management",https://jobright.ai/jobs/info/69e68d5d9b6eb37e26f80eef,https://boards.greenhouse.io/embed/job_app?token=5807984004&utm_source=jobright
CommonSpirit Health,IT Software Engineer,United States,8 hours ago,$43.20/hr - $64.26/hr,Remote,83.0384,59,2,True,"Lightning Web Components, Aura Components, SOQL, REST APIs, SOAP APIs, Git, Version Control Systems, CI/CD, Unit Testing, Debugging","Apex Development, SOSL, Visualforce, Platform Events, Change Data Capture, Healthcare environment experience, Salesforce Certified Platform Developer I, Salesforce Certified Platform Developer II",https://jobright.ai/jobs/info/69f7664ba3d34b4f76f5b821,https://jsv3.recruitics.com/redirect?rx_cid=3292&rx_jobId=2026-463529&rx_url=https%3A%2F%2Fwww.commonspirit.careers%2Fjob%2F-%2F-%2F35300%2F94497035552%3Fiis%3DLinkedinSlots%26iisn%3DLinkedinSlots%26mode%3Djob%26rx_campaign%3DLinkedin1%26rx_ch%3Dconnector%26rx_group%3D117215%26rx_id%3Dd08d5b16-443b-11f1-81d1-fb9b56edb882%26rx_job%3D2026-463529%26rx_medium%3Dpost%26rx_r%3Dnone%26rx_source%3DLinkedin%26rx_vp%3Dslots
PENNYMAC,Platform Engineer,"Carrollton, TX",11 hours ago,$90K/yr - $150K/yr,Onsite,80.4813,200,3,True,"Amazon Web Services (AWS), Terraform, AWS CloudFormation, AWS CDK, GitLab CI/CD, CI/CD pipeline design, Python scripting, Ruby scripting, PowerShell scripting, Bash scripting","Windows Server administration, Linux Server administration, Infrastructure-as-code (IaC), Deployment of .NET applications, Cloud security best practices, Networking principles, Monitoring, Logging tools",https://jobright.ai/jobs/info/6986e25f8ca8121a3a6966bc,https://careers.pennymac.com/jobs/37879/Platform+Engineer?lang=en-US&mode=apply&iis=LinkedIn&iisn=LinkedIn
Qualcomm,Software Engineer - Camera (Multiple Levels Available),"San Diego, CA",10 hours ago,$99K/yr - $148K/yr,Onsite,82.3484,200,2,True,"3A algorithms, Algorithm design, C programming, C++ programming, Python programming","Camera software development, Image Signal Processor (ISP), Image Quality (IQ), Tuning tools, Software architecture, Embedded systems, Computer architecture",https://jobright.ai/jobs/info/69c35eac7a7a0045db89136f,https://careers.qualcomm.com/careers/job/446715472289?hl=en-US&utm_source=linkedin&domain=qualcomm.com&source=APPLICANT_SOURCE-6-2
Cliff Services Inc,W2 Full Stack Java Developer (Kotlin + React + AI Tools),United States,12 hours ago,N/A,Remote,97.2353,35,N/A,True,"Java, React JS, Microservices architecture, REST APIs, Databases, Cloud environments, Git, CI/CD pipelines","Kotlin, Spring Boot",https://jobright.ai/jobs/info/69daa497738f2f099e8abc84,https://www.linkedin.com/jobs/view/4400594997
Old National Bank,Application Developer,"Evansville, IN",10 hours ago,$62K/yr - $153K/yr,Onsite,78.4172,78,3,True,"CL programming, Systems development life cycle","RPG programming, Embedded SQL, Change management systems, Financial industry knowledge",https://jobright.ai/jobs/info/696aa72bdb26b618950dcedb,https://careers-oldnational.icims.com/jobs/19074/application-analyst-iii/job?in_iframe=1&mode=apply&iis=LinkedIn&iisn=LinkedIn
Amazon Music,"Software Development Engineer, Music Metrics & Data Platform","San Francisco, CA",10 hours ago,$165K/yr - $224K/yr,Onsite,83.1468,200,2,True,"Software development, System design, Programming languages, Full software development lifecycle, Concurrent, AWS products, Code review feedback","Architecture, Mobile app development, Distributed systems, Services, Kotlin Multiplatform, Cross-platform SDK development",https://jobright.ai/jobs/info/69856bb08da7a612045ffde8,https://www.amazon.jobs/jobs/3175027/software-development-engineer-music-metrics--data-platform?cmpid=SPLICX0248M&utm_source=linkedin.com&utm_campaign=cxro&utm_medium=social_media&utm_content=job_posting&ss=paid
Anything,Product Engineer,"San Francisco, CA",10 hours ago,$125K/yr - $200K/yr,Onsite,81.4879,200,4,True,"TypeScript, React, Postgres, Data modeling, APIs, System design, Debugging","Frontend development, Tailwind, Backend fundamentals, Product ownership, Product engineering, Clear written",https://jobright.ai/jobs/info/69616e5ef3f4cd1325066570,https://jobs.ashbyhq.com/anything/643cd75f-6231-472d-b70e-1bec8c3e7d69/application?utm_source=ongJb0rM8a
Qualcomm,Sr AI Researcher for Agentic AI Core System Architecture,"San Diego, CA",11 hours ago,$159K/yr - $239K/yr,Onsite,91.7886,39,2,True,"Deep learning, Generative AI, Python, PyTorch, Reinforcement Learning (RL), Agentic AI concepts, LangChain, Software engineering principles, Version control, Git, Independent work","Transformers, Supervised Fine-Tuning (SFT), Managing multiple priorities",https://jobright.ai/jobs/info/69ebe569dc35f7132c4b442b,https://careers.qualcomm.com/careers/job/446716514171?hl=en-US&utm_source=linkedin&domain=qualcomm.com&source=APPLICANT_SOURCE-6-2
Toyota Material Handling,IT Application Developer,"Greene, NY",10 hours ago,$94K/yr - $121K/yr,Hybrid,93.4633,92,3,True,"Programming languages, Operating systems, Software testing, Data management, Version control systems, Troubleshooting, Debugging","Software security measures, UI/UX design concepts, Customer service, Analytical skills",https://jobright.ai/jobs/info/69d1e5190b098b7a67085197,https://recruiting.adp.com/srccar/public/RTI.home?r=5001181859406&c=1138141&d=TMHUCareerSite&rb=LINKEDIN
MSCI Inc.,AI Index Research Analyst,"New York, United States",6 hours ago,$110K/yr - $143K/yr,Hybrid,64.4723,200,1,True,"Large language models (LLMs), Applied AI research, Python programming, LangChain, SQL, Cloud environments, Azure, AWS, API-based solutions, Detail-oriented mindset","Retrieval-augmented generation (RAG) systems, Agentic workflows, AI orchestration frameworks, LlamaIndex, Snowflake, ClickHouse, GCP, Financial indexes, Investing, Thematic investing, Multi-step reasoning systems, Analytical skills",https://jobright.ai/jobs/info/69a322520da45516f16c6e06,https://careers.msci.com/job/research/new-york/ai-index-research-analyst/2025-4331?mode=apply&iis=LinkedIn
Kemper,Python Engineer Manager,"Downers Grove, IL",10 hours ago,$99K/yr - $165K/yr,Onsite,84.6259,34,5,True,"Python development, Data engineering, Data analysis, Cloud platforms, Data manipulation techniques, Data ingestion patterns, Analytical problem-solving","Data visualization, Actuarial principles, Insurance data structures, Regulatory compliance, Test-driven development",https://jobright.ai/jobs/info/69e961050a6e09555303b8c2,https://kemper.wd5.myworkdayjobs.com/Kemper_Careers/job/Downers-Grove-IL/Python-Engineer-Manager_R-26-0036079?source=LinkedIn
Deloitte,"Senior Full Stack Engineer, Platforms","Austin, TX",13 hours ago,$89K/yr - $182K/yr,Hybrid,89.376,55,5,True,"Object-Oriented Programming, Data Structures, Algorithms, Angular, React, NodeJS, Python, Java, SQL, NoSQL, Cloud-Native Engineering, Microservices, Azure, AWS, GitHub, Artificial Intelligence (AI)","Code Instrumentation, C#, .NET Core, Golang, Function as a Service (FaaS), Platform as a Service (PaaS), Google Cloud Platform (GCP), Extreme Programming (XP), Lean Methodology, Scaled Agile Framework (SAFe), DevSecOps, Site Reliability Engineering (SRE), Azure DevOps (ADO), SonarQube",https://jobright.ai/jobs/info/69f72785b1fc847fc1ae4fb7,https://apply.deloitte.com/en_US/careers/InviteToApply?jobId=327094&source=LinkedIn
Cyngn,Full Stack Software Engineer,"Mountain View, CA",9 hours ago,$153K/yr - $171K/yr,Hybrid,77.9761,200,2,True,"Python, TypeScript, JavaScript, API development, SQL, NoSQL, WebSockets, Event-driven systems, Performance tuning, Collaborative approach","Kafka, RabbitMQ, Pulsar, IoT, Robotics, Autonomy software, Fleet management software, AI coding assistants, Physical AI simulation tooling, Low ego",https://jobright.ai/jobs/info/69696fc91703f05405ab5476,https://jobs.lever.co/cyngn/ee7518e1-7f77-4655-b07d-ea968ec82127/apply?source=jobright
Applied Intuition,Software Engineer - Developer Infrastructure,"Sunnyvale, California, United States",16 hours ago,$120K/yr - $300K/yr,Onsite,84.0188,43,2,True,"Software Development, C++, Python, TypeScript, API Development, Code Quality, CI/CD, SQLAlchemy, Docker, Kubernetes, Terraform, AWS, Linux","Developer Infrastructure, Go, Library, Framework Development, Bazel, Buildkite, Service Architecture, GRPC, Fx (Golang), Ansible, Cloud Deployment, GCP, Drive",https://jobright.ai/jobs/info/6863199bf31c4006c6c3a06e,https://boards.greenhouse.io/embed/job_app?token=4581501005&utm_source=jobright
