Company,Title,Location,Publish Time,Salary,Work Model,Match Score,Applicants,Min YOE,H1B Sponsor,Matched Skills,Missing Skills,URL,Apply Link
Scopely,Senior Cloud Security Engineer,"US - Bellevue, United States",10 hours ago,$170K/yr - $253K/yr,Hybrid,86.725,96,3,True,"Cloud technologies, Programming languages, Java, Python, Cloud-centric infrastructure, Docker, Kubernetes, IAM","Go, Cloud Security, Security tooling, Automation",https://jobright.ai/jobs/info/6996129281476f6176adcd14,https://boards.greenhouse.io/embed/job_app?token=5110280008&utm_source=jobright
Included Health,Lead Solutions Engineer,United States,5 hours ago,$99K/yr - $167K/yr,Remote,78.3145,41,4,True,"SQL, Project management","Solutions Engineering, Technical foundation",https://jobright.ai/jobs/info/69a10f705218a8167672443a,https://www.linkedin.com/jobs/view/4377608849
TikTok,(General Hire) Research Scientist Graduate (TikTok Recommendation) - 2026 Start (BS/MS),"San Jose, CA",12 hours ago,$123K/yr - $256K/yr,Onsite,97.4413,200,N/A,True,"Software Development, Computer Science, Computer Engineering, Programming - C++, Programming - Python, Algorithms, Data Structures, Machine Learning, Deep Learning Frameworks - PyTorch, Deep Learning Frameworks - TensorFlow, Natural Language Processing, Computer Vision, Recommender Systems",,https://jobright.ai/jobs/info/694cc8b629655e4dd656f7cb,https://lifeattiktok.com/search/7532216894792222994?spread=5MWH5CQ
Factory,Developer Relations,"San Francisco, CA",23 hours ago,N/A,Onsite,85.0356,66,3,True,"Software Development, AI, Machine Learning, Software Development Tools, Project Management, Creative Thinking, Strategic Thinking","Developer Relations, Open-Source Community Engagement, Event Planning",https://jobright.ai/jobs/info/69f69b0a582f810f9c8c9b96,https://jobs.ashbyhq.com/factory/8a1b9535-e2de-487a-8f7f-9fb9fb80a912/application?utm_source=jobright
Amazon Web Services (AWS),"Senior AI Hardware Systems Engineer, Annapurna Labs, Trainium Machine Learning Fleet Operations","Austin, TX",8 hours ago,$159K/yr - $215K/yr,Onsite,77.1059,25,4,True,"Programming - C++, Programming - Java, Programming - Python, Programming - PowerShell, Software development, System design, Statistical analysis, Version control tools, Operating systems, Security, Database administration, Cloud infrastructure","Programming - C#, Programming - Golang, Programming - Ruby, Architecture, Computer architecture, Hardware troubleshooting, Firmware flashing, Device debugging, Server hardware troubleshooting, System optimization, System analysis, Reliability analysis, Automation, Hardware, Storage, Network, SOC bring-up, Post-silicon validation",https://jobright.ai/jobs/info/69bde7124828227293009a09,https://www.amazon.jobs/jobs/10372711/senior-ai-hardware-systems-engineer-annapurna-labs-trainium-machine-learning-fleet-operations?cmpid=SPLICX0248M&utm_source=linkedin.com&utm_campaign=cxro&utm_medium=social_media&utm_content=job_posting&ss=paid
Cyabra,Technical Solution Engineer,"New York, United States",10 hours ago,$80K/yr - $130K/yr,Hybrid,78.2379,25,N/A,True,"APIs, REST APIs, Cloud-based architectures, LLM prompt design","JSON, Technical sales, SaaS industry experience, Solution architecture",https://jobright.ai/jobs/info/69f745eedb88714bcdfb8be0,https://cyabra.bamboohr.com/careers/40?source=aWQ9MTg%3D
Deloitte,"AI Full Stack Engineer, Manager - Tax Transformation","Tampa, FL",11 hours ago,$119K/yr - $272K/yr,Hybrid,81.8464,33,5,True,"Full stack web development, SQL Server, OOPS Concepts, Microservices Architecture, Angular, React, NoSQL, Azure, Design Patterns, AWS Certified Solutions Architect","C#, .NET Core, ASP.NET Core Web API, Entity Framework 6, Above, Database performance tuning, Agile methodologies, CPA license, Attorney license, Enrolled Agent, Certified SAFe Advanced Scrum Master, Certified SAFe Agile Software Engineer, Certified SAFe Agilist, Certified SAFe Architect, Certified SAFe DevOps Practitioner, Certified SAFe Practitioner, Certified SAFe Scrum Master, Certified Scrum Developer (CSD), MCSD Application Lifecycle Management Solutions Developer, MCSD Web Applications",https://jobright.ai/jobs/info/68f9ad3bcadb2e5a06a66d22,https://apply.deloitte.com/en_US/careers/InviteToApply?jobId=315274&source=LinkedIn
Supermicro,Software QA Engineer (27301),"San Jose, CA",12 hours ago,$100K/yr - $135K/yr,Onsite,93.415,200,5,True,"Software Quality Assurance, Shell Scripting, Python",SQA Methodologies,https://jobright.ai/jobs/info/69d55610366bb95ba5544340,https://jobs.supermicro.com/job/San-Jose-Software-QA-Engineer-%2827301%29-Cali/1316818500/?utm_source=LINKEDIN&utm_medium=referrer&LinkedIn%20Job%20Slots=utm_source=linkedinjobpostings
Gensler,ServiceNow Developer,"Oakland, CA",5 hours ago,$100K/yr - $110K/yr,Onsite,80.4862,161,3,True,"PowerShell scripting, HTML, JavaScript, CSS, REST API development, Agile Software Development Life Cycle (SDLC)","ServiceNow System Administration, ServiceNow Certified System Administration (CSA), ServiceNow Certified Application Developer (CAD), ITIL Foundation, JSON, Third-party service integration, Customer Service",https://jobright.ai/jobs/info/69d5275ccdb525785fbcea75,https://gensler.wd1.myworkdayjobs.com/genslercareers/job/Los-Angeles-CA-US/ServiceNow-Developer_R-16983?source=Social+Media+%E2%80%93+LinkedIn
Ascot Group,Business Intelligence Engineer,"Iselin, NJ",11 hours ago,$95K/yr - $110K/yr,Hybrid,93.0931,200,2,True,"Power BI, SQL, Data modeling, Relational databases, ETL concepts","DAX, Data warehousing",https://jobright.ai/jobs/info/69a22eff359fe034b1cd6c9a,https://fa-emkq-saasfaprod1.fa.ocs.oraclecloud.com/hcmUI/CandidateExperience/en/job/897/?utm_medium=jobshare
General Motors,Software Developer-Test Engineering (Non AI),"Mountain View, CA",11 hours ago,$128K/yr - $196K/yr,Hybrid,68.7265,200,2,True,"Python, Java, C++, Software quality assurance, CI/CD tools, GitHub","Embedded software testing, Android testing, Test automation, Robot Framework, Scrum, Agile, Audio domain knowledge, Connectivity domain knowledge, Android Auto, CarPlay, Vehicle communication protocols, CAN, LIN, Jenkins, Artifactory, Curiosity, Analytical skills, Coordination",https://jobright.ai/jobs/info/69d5e06be63cea7a8b665cf0,https://generalmotors.wd5.myworkdayjobs.com/Careers_GM/job/Mountain-View-California-United-States-of-America/Software-Developer-Test-Engineering_JR-202516026?source=LinkedIn
LangChain,Deployed Engineer (Dallas),United States,11 hours ago,$150K/yr - $250K/yr,Remote,75.5918,191,3,True,"Python, JavaScript, LLM-powered applications, AI agents deployment, Cloud environments, Containers, Kubernetes concepts","Systems fundamentals, Agent-based applications design, Multi-step workflows, Orchestration, Failure handling, Customer engineering, Technical evaluations, Production software operation, Bias toward action",https://jobright.ai/jobs/info/69a1377081476f6176bb92c6,https://jobs.ashbyhq.com/langchain/8b533cc4-6654-44b4-b3fc-004def2a9927/application?utm_source=vxReVqRy6V
Atomic Machines,Embedded Software Engineer,"Santa Clara, CA",6 hours ago,$150K/yr - $180K/yr,Onsite,66.1857,38,2,True,"Modern C++ C++14/17, Modern C++ later, Python Scripting, Concurrency, Testing","Embedded Software Development, Firmware Development, ARM-based Microcontrollers e.g., ARM-based Microcontrollers STM32, Embedded Linux, Memory Management, Real-time Systems, Hardware/Software Interfaces SPI, Hardware/Software Interfaces I2C, Hardware/Software Interfaces UART, Hardware/Software Interfaces ADC, Hardware/Software Interfaces GPIO, Debugging Hardware/Software Interactions, Automation for Software Systems",https://jobright.ai/jobs/info/69f783b981706a5bd216c1c9,https://www.linkedin.com/jobs/view/4407704880
Qualcomm,Computer Vision Architect,"San Diego, CA",12 hours ago,$148K/yr - $222K/yr,Onsite,92.2345,114,3,True,"Computer Vision, Deep Learning, C++, Python, OpenCV, PyTorch, API Documentation","Vision APIs, TensorFlow, Embedded Systems, Hardware CV Accelerators",https://jobright.ai/jobs/info/69be7b18b10602456283fee3,https://careers.qualcomm.com/careers/job/446716310453?hl=en-US&utm_source=linkedin&domain=qualcomm.com&source=APPLICANT_SOURCE-6-2
Doximity,Data Analyst,United States,11 hours ago,$110K/yr - $150K/yr,Remote,80.8137,43,2,True,"Data Analysis, Statistical Concepts, Exploratory Data Analysis, Probability Theory, SQL, Python, Numpy, Object-Oriented Programming","Data Visualization, Pandas, Distributed Data Processing, Spark, Curiosity",https://jobright.ai/jobs/info/6985053a8da7a612045f4df2,https://boards.greenhouse.io/embed/job_app?token=6738818&utm_source=jobright
Delart,Cellular Systems Engineer,"Fremont, CA",36 minutes ago,$140K/yr - $200K/yr,Onsite,48.8712,25,3,True,Python,"4G-LTE, 5G-NR, IEEE 802 protocols, TCP/IP networking, Modem-level chipset tools, Qualcomm QXDM, Qualcomm QCAT, Samsung ShannonDM, Mobility management, Interference analysis, RAN architecture, Core Network architecture, Cellular protocol domain",https://jobright.ai/jobs/info/69f7d5d7db88714bcdfb9936,https://www.linkedin.com/jobs/view/4408399039
Qualcomm,Senior Linux Peripheral Software Engineer (Onsite at our Santa Clara Office),"Santa Clara, CA",10 hours ago,$124K/yr - $186K/yr,Onsite,78.1446,172,2,True,"C programming, C++ programming, Java programming, Python programming, Debugging techniques, Version control systems - Git, System performance tuning, Optimization, Scripting languages - Bash, Containerization technologies - Docker, Containerization technologies - Kubernetes, Linux distributions customization - Ubuntu, Linux distributions customization - Rocky Linux","Linux kernel development, Linux device driver development, Peripheral protocols, Buses, USB protocol, I2C protocol, I3C protocol, SPI protocol, MIPI protocols, Linux kernel architecture, Computer architecture, Embedded software systems, Software build tools - Make, Software build tools - CMake, Linux distributions customization - Fedora, Real-time operating systems, ARM architecture",https://jobright.ai/jobs/info/69a5fb210da45516f16ecc77,https://careers.qualcomm.com/careers/job/446716193257?hl=en-US&utm_source=linkedin&domain=qualcomm.com&source=APPLICANT_SOURCE-6-2
Prime Video & Amazon MGM Studios,"Applied Scientist II, Prime Video - Personalization and Discovery Science, Personalization and Discovery Science","Seattle, WA",9 hours ago,$136K/yr - $223K/yr,Onsite,90.2214,33,3,True,"Machine Learning, Deep Learning, Optimization Methods, Model Development, Algorithms, Data Structures, Parsing, Data Mining, Parallel Computing, Java, C++, Python, Unix/Linux, Professional Software Development","Online Learning, Numerical Optimization, Distributed Computing, High-Performance Computing",https://jobright.ai/jobs/info/68ddee22a125e75c422b00d0,https://www.amazon.jobs/jobs/3099334/applied-scientist-ii-prime-video--personalization-and-discovery-science-personalization-and-discovery-science?cmpid=SPLICX0248M&utm_source=linkedin.com&utm_campaign=cxro&utm_medium=social_media&utm_content=job_posting&ss=paid
Synechron,.NET Lead Full Stack Developer (React & Copilot),"Dallas, TX",8 hours ago,$100K/yr - $110K/yr,Onsite,94.2051,25,2,True,"React.js, GitHub Copilot, RESTful APIs, Web Services, CI/CD pipelines, Cloud services - Azure, Cloud services - AWS, SQL Server, MySQL, PostgreSQL, DevOps practices",".NET Core, .NET Framework, C#, Microsoft Copilot, Agile methodologies",https://jobright.ai/jobs/info/69f76827582f810f9c8cbf7a,https://www.linkedin.com/jobs/view/4407707603
Oracle,Data Center Technician 2,"Ashburn, VA",12 hours ago,$27.07/hr - $54.13/hr,Onsite,50.1947,200,3,True,"Linux/Unix, GRUB","Oracle Cloud Infrastructure, Server hardware knowledge, Storage hardware knowledge, Network hardware knowledge, IT hardware concepts, RAID, SAN, SCSI, Structured cabling, Fiber cabling, Copper cabling, Network switch troubleshooting, Telco connectivity troubleshooting, Inventory management",https://jobright.ai/jobs/info/69c415ed6f4f855eeda6718a,https://eeho.fa.us2.oraclecloud.com/hcmUI/CandidateExperience/en/job/328067/?utm_medium=jobboard&utm_source=LinkedIn
Shield AI,Hardware Test - Senior Software Engineer,"Boston, MA",11 hours ago,$128K/yr - $192K/yr,Onsite,67.5957,156,N/A,True,"Python, Linux, Bash scripting, Software development, Fundamental computer science, Mathematics","Networking, Hardware interfacing, Driver development, Computer networks, Electrical engineering concepts, Mechanical engineering concepts, Physics, High standards, Kindness",https://jobright.ai/jobs/info/69f738c481706a5bd216b3c5,https://jobs.lever.co/shieldai/a6b11a01-e749-4b1a-90a4-828524ceb7a0/apply?lever-source=LinkedIn
Northslope Technologies,Forward Deployed Engineer - Mission Platform,"New York, United States",10 hours ago,N/A,Hybrid,59.5343,182,3,True,"Python, SQL, AI/LLM tools usage","Internal tools development, Automation scripting, Operational complexity management, Equity administration, Fundraising operations, International entity setup, IT security tooling, Government procurement, Multi-jurisdictional compliance, Entrepreneurial ownership mindset, Judgment, Fast learner, Hyper-organization",https://jobright.ai/jobs/info/69bfc5b97798f73e35e49ff1,https://jobs.ashbyhq.com/northslope-technologies/056b5ea2-47f2-4d0c-8767-c327fe5f0a9b?utm_source=GWdbmze7YL
Princeton University,Senior PeopleSoft Developer/Analyst II,"Princeton, NJ",9 hours ago,$121K/yr - $137K/yr,Hybrid,71.3268,87,5,True,"SQL, Debugging, HTML5, CSS, JavaScript, Security principles","PeopleSoft development, PeopleSoft HCM, PeopleTools, Application Designer, Application Engine, PeopleCode, Application Packages, SQR, Tracing PeopleSoft sessions, XML, Agile methodology, Waterfall methodology, Analytical skills",https://jobright.ai/jobs/info/69863f820f6f7e7a2ce1216c,https://main-princeton.icims.com/jobs/21492/senior-peoplesoft-developer-analyst-ii/job?hub=15&in_iframe=1&mode=apply&iis=LinkedIn&iisn=LinkedIn
Esri,C++ Windows Developer II - ArcGIS Pro,"Redlands, CA",6 hours ago,$101K/yr - $167K/yr,Onsite,86.1927,25,2,True,"C++, Asynchronous programming, DBMS","Task Parallel Library, C#, MVVM application design pattern",https://jobright.ai/jobs/info/69a0931181476f6176bae609,https://www.linkedin.com/jobs/view/4378393227
Vail Systems,"Software Engineer, Test & Infrastructure II",Greater Chicago Area,6 hours ago,$89K/yr - $116K/yr,Hybrid,84.2706,60,2,True,"Python, Java, C++, JavaScript, JUnit, TestNG, PyTest, Docker, Kubernetes, WebRTC, SQL, NoSQL","Perl, Ruby, C#/.NET, RSpec, Cucumber, Jenkins, Distributed Architectures, API Testing, Network-level Debugging, SIP, SDP, RTP, Analytical Skills",https://jobright.ai/jobs/info/690d3865221b890c27804d4e,https://www.linkedin.com/jobs/view/4334781170
Navan,Senior Business Systems Engineer,"San Francisco, CA",7 hours ago,N/A,Onsite,68.0326,56,3,True,"JavaScript, Web Services - REST, HTML, CSS","NetSuite development, SuiteScript, SuiteFlow, SuiteTalk, SuiteBuilder, Web Services - SOAP, AI coding assistants, Integration platforms - Workato, Integration platforms - Mulesoft, Integration platforms - Dell Boomi, Accounting, Business processes, Order to Cash, Procure to Pay, General Ledger, NetSuite certifications, Analytical skills",https://jobright.ai/jobs/info/69f77971a3d34b4f76f5b95c,https://boards.greenhouse.io/embed/job_app?token=7859128&utm_source=jobright
Amazon,"Language Engineer, Artificial General Intelligence - Data Services","Bellevue, WA",9 hours ago,$86K/yr - $151K/yr,Onsite,95.3132,56,2,True,"Language data processing, AI data creation, Language data annotation systems, Python, Speech data processing, Machine Learning, API, Version control, Database queries, Data analysis","Language data collection, Computational linguistics, Text data processing, Multimodal data processing, Agile development",https://jobright.ai/jobs/info/6932a977f131d96e4845d6d9,https://www.amazon.jobs/jobs/3137792/language-engineer-artificial-general-intelligence--data-services?cmpid=SPLICX0248M&utm_source=linkedin.com&utm_campaign=cxro&utm_medium=social_media&utm_content=job_posting&ss=paid
Anthropic,"Applied AI Engineer, Life Sciences (Beneficial Deployments)","San Francisco, CA",8 hours ago,$280K/yr - $320K/yr,Hybrid,66.6689,200,4,True,"Large Language Models, Prompt Engineering, Software Engineering","Life Sciences Research, Biomedical Research, Scientific Computing, Genomics, Neuroscience, Drug Discovery, Context Engineering, Agent Architectures, Evaluation Frameworks, Production Systems Development",https://jobright.ai/jobs/info/6986b1328da7a6120461970a,https://boards.greenhouse.io/embed/job_app?token=5111942008&utm_source=jobright
Capital One,Applied Researcher II,"New York, NY",5 hours ago,$262K/yr - $300K/yr,Onsite,87.6706,30,4,True,"Machine Learning, AI Foundation Models, Deep Learning, Natural Language Processing (NLP), Self-Supervised Learning, Reinforcement Learning with Human Feedback (RLHF), Cloud Computing Platforms, PyTorch, AWS, Vector Databases, Large Language Models (LLM), Model Sparsification, Transfer Learning, Model Adaptation, Model Guidance, Model Alignment","Applied Research, Training Optimization, Explainability, Huggingface, Lightning, Graph Neural Networks, Sequential Models, Multivariate Time Series, Quantization, Training Parallelism, Gradient Checkpointing, Model Compression, Adversarial Machine Learning, Red Teaming",https://jobright.ai/jobs/info/69a28ee5359fe034b1cddab1,https://www.capitalonecareers.com/job/-/-/234/92168538416?p_sid=aLa6EWb&p_uid=96NMbJRGkz&source=jobright&ss=paid&utm_campaign=tech_26&utm_content=pj_board&utm_medium=jobad&utm_source=jobright
General Motors,Senior Software Engineer -- ADAS Sensors,"Austin, TX",10 hours ago,$153K/yr - $234K/yr,Hybrid,67.1432,143,4,True,"C++, Linux-based systems, Software design analysis, Production-quality software development, C, Python","Embedded Linux, POSIX systems, Software best practices, Embedded build systems, Buildroot, Yocto, Networking, TCP/IP, UDP, ROS, Robotics middleware, Bash, Go, QNX, VxWorks, RTOS, Lidar, Radar, Camera systems, Motion sensing devices, GNSS, IMU, Wheel encoders, Safety critical development",https://jobright.ai/jobs/info/69963813ce78e77b4fda2d79,https://generalmotors.wd5.myworkdayjobs.com/Careers_GM/job/Sunnyvale-California-United-States-of-America/Senior-Software-Engineer----ADAS-Sensors_JR-202521409?source=LinkedIn
Amazon,"Applied Scientist, Artificial General Intelligence, AGI Data Services","Bellevue, WA",8 hours ago,$136K/yr - $184K/yr,Onsite,87.2211,34,N/A,True,"Machine Learning, Statistics, Large Language Models, Java, C++, Python, SQL, Relational Database Management Systems","Quality Assurance, Auditing Methodologies, Automated Evaluation Systems, Multimodal Systems",https://jobright.ai/jobs/info/69bdde35b1060245628343c4,https://www.amazon.jobs/jobs/10372646/applied-scientist-artificial-general-intelligence-agi-data-services?cmpid=SPLICX0248M&utm_source=linkedin.com&utm_campaign=cxro&utm_medium=social_media&utm_content=job_posting&ss=paid
TikTok,Sr. Large Model Training Acceleration Engineer,"San Jose, CA",4 hours ago,$213K/yr - $388K/yr,Onsite,74.1545,25,3,True,"AI model training optimization, Python, C++, Deep learning frameworks, PyTorch, Model parallelism","CUDA, Megatron, Deepspeed, Distributed training techniques, Data parallelism, Pipeline parallelism, Transformers, Diffusion models",https://jobright.ai/jobs/info/69f7cc2481706a5bd216c448,https://www.linkedin.com/jobs/view/4408375962
Wave Life Sciences,Microsoft 365 Copilot AI Co-op (Fall 2026),Greater Boston,12 hours ago,N/A,Onsite,66.9512,200,N/A,True,"Large Language Model (LLM) design, Prompt engineering, Power Apps, Power BI","Power Platform, Copilot Studio, Security mindset, SharePoint extensibility, OneDrive extensibility, Teams extensibility, Power Automate, Copilot connectors",https://jobright.ai/jobs/info/69699e07639b452fb57f8f6c,https://ectf.fa.us2.oraclecloud.com/hcmUI/CandidateExperience/en/job/437/?utm_medium=jobshare&utm_source=linkedin
Apex Fintech Solutions,SDET (Software Development Engineer in Test),"Austin, TX",9 hours ago,N/A,Hybrid,81.3237,200,3,True,"Software development, Software quality assurance, Non-functional testing, Manual testing, API automation, Junit, Kubernetes, Docker, Event-driven systems","Risk assessment, Test planning, Automated testing, JMeter, Performance testing, Scalability testing, Cloud-based microservices testing, Google Cloud Platform, RabbitMQ, Kafka, Google Pub/Sub, Financial services domain knowledge",https://jobright.ai/jobs/info/6969a06f1703f05405ab9f75,https://apexfintechsolutions.ongig.com/jobs/technology/austin-texas-united-states-of-america/sdet-software-development-engineer-in-test-/JR104107?utm_source=linkedin&utm_medium=referral&utm_campaign=ongig-job-aggregators&group=1961&source=LinkedIn
Edwards Lifesciences,"Senior Analyst, Data Analytics, Program Operations and Analytics","Irvine, CA",9 hours ago,$92K/yr - $130K/yr,Onsite,70.316,200,5,True,"SQL, ETL/ELT development, Power BI, Row-level security (RLS), Analytics solutions integration, Data governance, Data quality monitoring, Data standardization, Project management","Dataflow Gen2, Enterprise system data ingestion, Semantic modeling, DAX, Star schema design, Scalable data model design, Dashboard development, Database-centric applications, Snowflake, Analytical/statistical model development, Master data management, Data validation, Stakeholder management",https://jobright.ai/jobs/info/69c8c338aa3c2c1995e20538,https://edwards.wd5.myworkdayjobs.com/en-US/EdwardsCareers/job/USA---California--Irvine/Senior-Analyst--Data-Analytics--Program-Operations-and-Analytics_Req-45582?source=LinkedIn
Qualcomm,CPU SW Math Acceleration Engineer,"San Diego, CA",11 hours ago,$94K/yr - $141K/yr,Onsite,81.4245,67,N/A,True,"Linear algebra, AI/ML, Performance evaluation, ML model inferencing, PyTorch, Programming, Debugging skills","ARM CPU architecture, ARM ISA, Application optimization, TensorFlow, Open source library design, Vector, Matrix accelerator algorithms, Analytical skills",https://jobright.ai/jobs/info/69e097c3ba9bd32d0337106b,https://careers.qualcomm.com/careers/job/446717101477?hl=en-US&utm_source=linkedin&domain=qualcomm.com&source=APPLICANT_SOURCE-6-2
OU Health,"Business Intel. Developer (Epic Cogito, Clarity & Caboodle)","Oklahoma City, US",19 minutes ago,N/A,Onsite,66.5557,25,3,True,"SQL, Relational databases, Data modeling, Performance tuning, Microsoft SQL Server, PowerBI, Clarity Data Model","SQL stored procedures, SQL views, SQL functions, Indexing, Business Intelligence tools, Tableau, Epic Cogito, Epic Clarity, Epic Caboodle, Cogito Fundamentals, Cogito Tools Administration, Caboodle Data Model, Access Data Model, Clinical Data Model, Revenue Data Model, Healthcare IT, Clinical workflows, Terminology, Accounts receivable systems, Electronic Health Record (EHR) systems, Effective oral, Analytical mindset, Independent",https://jobright.ai/jobs/info/69f7d9fab1fc847fc1ae68ea,https://oumedicine.wd5.myworkdayjobs.com/ouhealthcareers/job/Oklahoma-City/Business-Intelligence-Developer_R0060542
Kimley-Horn,Microsoft Power Platform Specialist,"Richmond, VA",9 hours ago,N/A,Onsite,78.5052,54,3,True,"Microsoft Power Platform, AI Builder, AI Hub, Power Apps, REST API integration","Power Automate, Copilot Studio, Microsoft Dynamics 365 CE development, Power Platform administration, Power Platform governance, Passion for process improvement, Prioritize multiple projects",https://jobright.ai/jobs/info/69bda95cb106024562829ca8,https://careers-kimley-horn.icims.com/jobs/23021/microsoft-power-platform-specialist/job?mode=job&iis=Job+Board&iisn=LinkedIn
American Heart Association,"Sr. Statistical Analyst, Development",United States,9 hours ago,$90K/yr - $100K/yr,Remote,73.3813,193,5,True,"Statistical analysis, Segmentation, Data extraction, Data manipulation, Data transformation, SQL, Python, Data modeling, Data quality validation, Azure Synapse, Databricks","Regression, Forecasting, Scoring, R, Data visualization, Tableau, CRM data, Salesforce, Cloud data platforms, Snowflake, Business intelligence tools, Automation platforms, Alteryx, Autonomy",https://jobright.ai/jobs/info/69dcf19061f6ed54321f9e28,https://heart.jobs/dallas-tx/sr-statistical-analyst-development/648853F4A76A4C15B2901644F3F28A2E/job/?vs=1606&utm_source=LinkedIn.com-DE&utm_medium=Social%20Media&utm_campaign=LinkedIn.com
Appian,Information Security Application Engineer (2026 Graduates),"McLean, VA",11 hours ago,N/A,Onsite,76.2609,200,N/A,True,"Programming, Java, Python, C/C++, HTTP/S, Linux/Unix environment, Cloud infrastructure, IaaS, API integration, Data analysis, Authentication","Network fundamentals, Internet protocols, TCP/IP, DNS, DHCP, Windows environment, SaaS, PaaS, Application development, Secure software development, Threat modeling, Vulnerability management, Authorization, Encryption, Secure coding practices",https://jobright.ai/jobs/info/69c4995a33eecf310794fe5d,https://job-boards.greenhouse.io/appian/jobs/7722009?gh_src=9e63858d1us
FICO,Analytic Science - Scientist II,"San Diego, CA",10 hours ago,$98K/yr - $154K/yr,Onsite,74.4292,200,N/A,True,"Data Mining, Data Cleaning, Statistical Analysis, Java, Python, C++, C, Neural Networks, Support Vector Machines","Predictive Modeling, Perl, Bash, Logistic Regression, Non-linear Regression, Random Forests, Decision Trees, Linear Optimization, Non-linear Optimization",https://jobright.ai/jobs/info/69f746c3a3d34b4f76f5b0ff,https://fico.wd1.myworkdayjobs.com/en-US/External/job/San-Diego-CA/Analytic-Science---Scientist-II_31113?source=LinkedIn
