Company,Title,Location,Publish Time,Salary,Work Model,Match Score,Applicants,Min YOE,H1B Sponsor,Matched Skills,Missing Skills,URL,Apply Link
CDW,Senior AI Engineer,"Illinois, United States",5 hours ago,$124K/yr - $175K/yr,Onsite,80.4881,200,5,True,"AI/ML applications, Large Language Models (LLMs), LangChain, Vector databases, Prompt Engineering, ReAct, CI/CD pipelines, API integration","Orchestration frameworks, LangGraph, Pinecone, Weaviate, Pgvector, Chain-of-Thought, Few-Shot Prompting, Tracing tools",https://jobright.ai/jobs/info/6986441e8da7a6120460f57a,https://www.cdwjobs.com/en/jobs/17247084-senior-ai-engineer?bid=370&rx_campaign=Linkedin1&rx_ch=connector&rx_group=110011&rx_id=295ef5ef-f70d-11f0-965c-dfddfc4e1258&rx_job=R26_00000124&rx_medium=post&rx_r=none&rx_source=Linkedin&rx_ts=20260412T061203Z&rx_vp=slots&tm_company=2376&tm_event=view&tm_job=R26_00000124
Arevon,"Software Developer, Business Systems & Analytics","Scottsdale, AZ",13 hours ago,N/A,Onsite,84.428,25,2,True,"Python, JavaScript, React, Redux, AWS, Django REST framework, Docker, MongoDB, PostgreSQL, GitHub, Terraform, Single-page application development","Vite, Snowflake, TimescaleDB, CircleCI, UI/UX design for data-intensive software, Backend systems for large data volumes, Self-sufficient problem solving, Autonomy",https://jobright.ai/jobs/info/69e2cee93ce36005badbfdfd,https://boards.greenhouse.io/embed/job_app?token=5027450007&utm_source=jobright
Invesco,"Adv Eng, SIP","Houston, TX",5 hours ago,N/A,Onsite,95.8974,54,3,True,"Python, TypeScript, React, NodeJS, SQL, Containerization, Docker, Git, AWS Cloud, CI/CD Automation, Generative AI, Large Language Models, Azure API Management, LangChain","Full Stack Development, .NET ASPCORE, Test Driven Development, Azure AI Services",https://jobright.ai/jobs/info/69db43175356a60f40fe623e,https://invesco.wd1.myworkdayjobs.com/IVZ/job/Atlanta-Georgia/Adv-Eng--SIP_R-13382?source=LinkedIn
Hyatt,Senior Product Engineer (Remote Opportunity),United States,10 hours ago,$115K/yr - $145K/yr,Remote,84.3648,72,5,True,"Software Engineering, Java, JavaScript, AngularJS, Node.js, SQL, RESTful Services, API Development, APIGEE, Continuous Integration, Continuous Deployment, Git, Bash Scripting","Software Architecture, Agile Methodology, Spring Boot, Hibernate, JPA, MyBatis, Relational Database Design, Nginx, JSON, Apache Kafka, Automated Testing, Karma, Selenium, Protractor, WebDriver, Jasmine, Jenkins",https://jobright.ai/jobs/info/69e96129e0cd471b2f13d0fe,https://careers.hyatt.com/en-US/careers/jobdetails/10780/CHI015253?src=SNS-102
StubHub,Software Engineer II - Active Support,"New York, NY",12 hours ago,$165K/yr - $200K/yr,Hybrid,79.2663,200,2,True,"Java, Python, Debugging, API Design, Data Modeling, AI Integration","Backend Development, Golang, Service Ownership, Monitoring, Service Architecture, Scalable Distributed Systems, Automation, Agentic Systems",https://jobright.ai/jobs/info/69a113b66b458d060735c93c,https://job-boards.eu.greenhouse.io/stubhubinc/jobs/4791891101?gh_src=47e65a22teu
Cornerstone OnDemand,Senior Software Engineer,"Dublin, CA",11 hours ago,$115K/yr - $183K/yr,Onsite,95.0379,200,5,True,"Java, AWS, SQL, NoSQL, RESTful APIs, GraphQL, Docker, Kubernetes, AI integration, Cloud-native services","Backend development, Service-oriented architectures, Quality-first mindset",https://jobright.ai/jobs/info/69a28a5c359fe034b1cdd611,https://cornerstone.csod.com/ux/ats/careersite/2/home/requisition/10972?c=cornerstone&source=LinkedIn
Yahoo,Senior Software Engineer,United States,13 hours ago,$128K/yr - $267K/yr,Remote,87.4271,200,4,True,"C++, Python, Machine Learning Model Integration, AWS, Large-scale Backend Systems, Collaborative Leadership","Backend API Design, Service-Oriented Architecture, AI-assisted Development Tools, PySpark, Spark",https://jobright.ai/jobs/info/69c4d8d4d5a1016e98dc3838,https://ouryahoo.wd5.myworkdayjobs.com/en-US/careers/job/United-States-of-America/Senior-Software-Engineer_JR0026855?source=LinkedIn
Whatnot,Data Engineer,"San Francisco, CA",9 hours ago,$180K/yr - $260K/yr,Hybrid,65.2063,200,3,True,"Data modeling, Data transformation, Python, SQL, CI/CD","Data architecture, Dimensional modeling, Data Vault modeling, Ledger-style data modeling, Data ingestion, Kafka, Debezium, Dbt, Spark, Flink, Data orchestration, Dagster, Airflow, Data observability, Monte Carlo, Great Expectations, Cloud data warehouses, Snowflake, BigQuery, Redshift, Schema design, Cost optimization, Workload tuning, Infrastructure as code, Curiosity",https://jobright.ai/jobs/info/68f9338b6de2db04dc3e6925,https://jobs.ashbyhq.com/whatnot/9fd6fef1-619f-48dd-97b0-c91063432df3/application?utm_source=LinkedInJobWrapping
Fanatics,"Fullstack, Software Engineer II, Sportsbook - FBG",United States,13 hours ago,$95K/yr - $156K/yr,Remote,89.5544,177,2,True,"Java, Spring Boot Microservices, Version control tools, Git, Object-oriented programming, Design patterns, AWS, Docker, Kubernetes, Continuous Integration/Continuous Deployment, Software design principles, A/B testing, Event-driven architecture, System debugging","JPA, Distributed caching, Message-oriented middleware, Kafka, SVN, UML, Google Cloud Platform, Agile methodologies, SCRUM, Highly available distributed systems, Analytical skills",https://jobright.ai/jobs/info/69d9cd0a5356a60f40fdcad5,https://job-boards.greenhouse.io/fanaticsfbg/jobs/4216147009?gh_src=k819kf909us
Capital One,Applied Researcher II (AI Foundations),"McLean, VA",7 hours ago,$262K/yr - $300K/yr,Onsite,89.8862,27,4,True,"AI foundation models, Machine learning, Deep learning, Natural language processing (NLP), Self-supervised learning, Reinforcement learning from human feedback (RLHF), Cloud computing platforms, Open-source programming languages, Large language models (LLMs), Model fine-tuning, Transfer learning, Model adaptation, Model guidance","Training optimization, Model robustness, Explainability, Compiler design, Innovation",https://jobright.ai/jobs/info/69a2c08ab600907a96292ee0,https://www.capitalonecareers.com/job/-/-/234/92195849728?p_sid=6ONq0Nb&p_uid=mAIpvNJmQJ&source=rd_linkedin_job_posting_Tech_tm&ss=paid&utm_campaign=tech_26&utm_content=pj_board&utm_medium=jobad&utm_source=linkedin+slotted
TextNow,Software Developer — iOS - US,United States,12 hours ago,$149K/yr - $299K/yr,Remote,69.8557,29,N/A,True,"Modern Concurrency async/await, Modern Concurrency actors, Performance Optimization, System-level Debugging, AI, CI/CD","Swift, SwiftUI, Objective-C, IOS Application Development, Architectural Modernization, Modular System Design, Automation for Development, Telemetry",https://jobright.ai/jobs/info/696aaf7a350cf4380311aaa9,https://www.linkedin.com/jobs/view/4359215648
Qualcomm,Software Engineer - Modem,"San Diego, CA",10 hours ago,$104K/yr - $156K/yr,Onsite,71.0992,200,1,True,"C programming, C++ programming, Python programming, Modeling","Computer architecture, Embedded systems, Wireless WAN modem development, Semiconductor industry experience, Modem air interface software, Radio Access Technology (RAT), 3GPP LTE, 5G NR, RF specifications, WWAN L1/L2/L3 specifications, Simulation, Test case development",https://jobright.ai/jobs/info/69da72c3738f2f099e8a95c9,https://careers.qualcomm.com/careers/job/446717980955?hl=en-US&utm_source=linkedin&domain=qualcomm.com&source=APPLICANT_SOURCE-6-2
Cockroach Labs,Member of Technical Staff (Storage),"New York, NY",10 hours ago,$185K/yr - $200K/yr,Hybrid,77.7836,200,3,True,"Concurrency Control, C, C++, Java, Python","Distributed Systems, File Systems, Data Replication, Memory Management, Go, Product Architecture, AI-centric Development Workflows, Log-Structured Merge Trees, Large-scale Distributed Systems",https://jobright.ai/jobs/info/69a1eff0b600907a96283ecc,https://boards.greenhouse.io/cockroachlabs/jobs/7663160?source=LinkedIn
Lam Research,Computational Software Development Engineer,"Waltham, MA",12 hours ago,N/A,Hybrid,68.5768,172,N/A,True,"Modern C++ programming, Software engineering, Linear algebra, Calculus","3D physical simulation algorithms, Finite element method, Finite volume method, Iterative linear solver methods, Conjugate gradient method, Multigrid methods, Numerical solvers for electrostatic equations, Geometry",https://jobright.ai/jobs/info/69d5f9b74a12eb12c5e15168,https://careers.lamresearch.com/careers/job/1099550591057?src=Eightfold
Klaviyo,Senior Software Engineer - Channel Processing,"Boston, MA",11 hours ago,$148K/yr - $222K/yr,Onsite,77.2849,88,4,True,"Software Engineering, Performance Optimization, Python, React, MySQL, AWS, Terraform, Coaching","Large-scale System Architecture, Scalability, Data-driven Product Improvement, System Monitoring, Alerting Techniques, Django, Redis, Memcached, Apache Zookeeper, Apache Pulsar, Jenkins",https://jobright.ai/jobs/info/69a136f16b458d060735f23d,https://www.klaviyo.com/careers/jobs?gh_jid=7646799003&gh_src=1284ec8c3us
"Aledade, Inc.","Senior Software Engineer I, Backend",United States,9 hours ago,N/A,Remote,79.816,200,4,True,"Full-stack web application development, SQL, Database querying, ETL/ELT pipeline development, Python, Testing frameworks, Large dataset management, Performance tuning, Coaching","Technical decision-making, Airflow, Batch data pipelines, Streaming data pipelines, Spark, Data validation automation, Data storage technologies, Data ingestion systems, Database systems, Database replication, Database sharding, Database scalability, High availability databases",https://jobright.ai/jobs/info/68ce66c8dbd9fb154eddf3e0,https://jobs.lever.co/aledade/a788ae8d-0bbb-4b1e-aa7b-dc9aeb70994f/apply?source=LinkedIn
Lam Research,Software Engineer Sys 2,"Fremont, CA",12 hours ago,$86K/yr - $183K/yr,Hybrid,74.4313,182,2,True,"Data modeling, Asynchronous processing systems, Docker, Kubernetes, CI/CD pipelines, Generative AI, Vector databases, Prompt engineering, ReAct","Backend engineering, Service design, FAISS, Milvus, Weaviate, Caching systems, Redis, Memcache, Retrieval-augmented generation, Indexing, Chunking, Embeddings, Reranking, Context engineering, Agent design, Multi-step agent workflows, Failure handling, Translate complex technical ideas into scalable architectures",https://jobright.ai/jobs/info/69ef737958811370cb14652a,https://careers.lamresearch.com/careers/job/1099551694604?src=Eightfold
Deloitte,Unqork Developer,"Morristown, NJ",13 hours ago,$108K/yr - $198K/yr,Onsite,86.7168,25,4,True,"RESTful APIs, Authentication, Authorization services, OAuth 2.0, OpenID Connect, Unit testing, Integration testing, Continuous integration, Continuous delivery (CI/CD), Cloud platforms, Amazon Web Services (AWS), Microsoft Azure","Unqork platform development, Enterprise application delivery, Database integration, Defect triage, Google Cloud Platform (GCP), Unqork Developer, Architect certification, Agile delivery, Scrum ceremonies",https://jobright.ai/jobs/info/69d9dd6a5356a60f40fdcfcf,https://deloitteus.avature.net/careers/InviteToApply?jobId=325528&source=jobright
Amazon,"Software Development Engineer, Items and Offers Platform, Catalog Diagnostics & Analytics","Sunnyvale, CA",9 hours ago,$165K/yr - $224K/yr,Onsite,86.3328,52,3,True,"Fault Tolerant Systems, Data Pipelines, Code Reviews, System Performance Optimization, C++, Java, Object Oriented Design, Software Development Life Cycle","Distributed Systems, Scalable Systems, High Throughput Systems, Real-time Data Processing, Anomaly Detection, Automated Troubleshooting, C#, Perl",https://jobright.ai/jobs/info/69bde44b48282272930096aa,https://www.amazon.jobs/jobs/10372417/software-development-engineer-items-and-offers-platform-catalog-diagnostics--analytics?cmpid=SPLICX0248M&utm_source=linkedin.com&utm_campaign=cxro&utm_medium=social_media&utm_content=job_posting&ss=paid
OpenAI,"Fullstack Engineer, Intelligence Systems","San Francisco, CA",9 hours ago,$230K/yr - $325K/yr,Hybrid,90.0904,200,N/A,True,"Data Analysis, SQL, Python, AI Techniques, Project Management, Cross-functional Team Collaboration","Security Engineering, Intelligence Systems, Data Visualization",https://jobright.ai/jobs/info/69154f2f286ccf0a1512d304,https://jobs.ashbyhq.com/openai/52c72cb9-7c44-4cba-b440-e05262a38491/application
Carbon Robotics,"Jr. Software Engineer, Robot Systems","Seattle, WA",16 hours ago,$125K/yr - $140K/yr,Onsite,91.0147,90,N/A,True,"C++, Python, Git, Docker, Computer vision algorithms, Effective verbal communication, Effective written communication","Linux development environment, Bash, Robotic algorithms, Desire to work in multidisciplinary teams",https://jobright.ai/jobs/info/69f6f0efb1fc847fc1ae4c02,https://boards.greenhouse.io/embed/job_app?token=4672950006&utm_source=jobright
"McLane Company, Inc.",Cloud Engineer,"Austin, TX",13 hours ago,N/A,Hybrid,72.8574,200,3,True,"Cloud platforms - AWS, Cloud platforms - Azure, Terraform, Python, Bash scripting, Containerization, Docker, Kubernetes, Performance tuning","Cloud platforms - GCP, Infrastructure as Code, Agile methodologies, Project management tools - Jira, Project management tools - Azure DevOps, Cloud monitoring tools, FinOps, Cloud certifications, Incident management, Capacity planning",https://jobright.ai/jobs/info/69f7220681706a5bd216adbd,https://aa224.taleo.net/careersection/ex/jobdetail.ftl?job=JR105099&src=DM-10301
Qualcomm,"Senior Engineer, Machine Learning ( Agentic AI SW )","San Diego, CA",10 hours ago,$141K/yr - $211K/yr,Onsite,96.8155,134,3,True,"C++, Python, Deep Learning, Machine Learning Frameworks, PyTorch, Software Design, Software Development, Software Debugging, AI Software Stack","Embedded Platforms, Android Programming, SDKs",https://jobright.ai/jobs/info/69a55561b600907a962af721,https://careers.qualcomm.com/careers/job/446716557466?hl=en-US&utm_source=linkedin&domain=qualcomm.com&source=APPLICANT_SOURCE-6-2
ACA Group,Software Developer/Engineer,"North Carolina, United States",10 hours ago,N/A,Hybrid,79.5121,200,N/A,True,"Software development, Cloud-native software, Angular, Microservices, API design, AI integration","Full-stack development, C#/.NET, Automation, Financial systems, SaaS platforms, Real-time data pipelines, Curiosity",https://jobright.ai/jobs/info/6931e1df4c474121999f3f34,https://careers.acaglobal.com/job/Software-DeveloperEngineer-NC/1347417100/?utm_source=LINKEDIN&utm_medium=referrer
Uber,"Application Developer II, Oracle EPM","New York, NY",9 hours ago,$153K/yr - $170K/yr,Onsite,62.5202,55,4,True,"Groovy scripting, SQL","Oracle EPBCS, Oracle PCMCS, Financial planning, Budgeting, Cost distribution, EPM Automate, ASO cubes, BSO cubes, Analytical skills",https://jobright.ai/jobs/info/69bd9e36393a1008f742f880,https://tnl2.jometer.com/v2/job?jz=5wqzs38b0507f66702cb7c830a4fe3e92d125KMALBBQAAADQ&iis=Job%20Board%20-%20Recruitment%20Marketing&iisn=LinkedIn
Cliff Services Inc,React JS Developer (AI Tools Preferred),"Phoenix, AZ",10 hours ago,N/A,Onsite,88.302,31,N/A,True,"React JS, JavaScript (ES6+), HTML, CSS, REST APIs, Redux, Git","State Management, Context API",https://jobright.ai/jobs/info/69daa48b9f97a42dc9c2bab5,https://www.linkedin.com/jobs/view/4400603755
Aurora,"Software Engineer I, Visualization","Mountain View, California",7 hours ago,$116K/yr - $160K/yr,Hybrid,78.2186,25,N/A,True,"Computer Science fundamentals, Software engineering, JavaScript, TypeScript, React, Redux, Python, C++","MobX, Webpack, Go, 3D web visualization, Geospatial applications, Three.js, D3.js, Mapbox.gl, ROS, Empathy",https://jobright.ai/jobs/info/69af8e287495006450940f82,https://boards.greenhouse.io/embed/job_app?token=8372578002&utm_source=jobright
Cushman & Wakefield,Artificial Intelligence Lead (Engineer),"Creve Coeur, MO",12 hours ago,$125K/yr - $147K/yr,Onsite,91.1827,82,5,True,"Python, TypeScript, Node.js, SQL, Machine learning, Deep learning, Generative AI, Data modeling, Vector databases, Event-driven architectures, API development, Microservices, Software engineering fundamentals, LLM integration, Multimodal AI integration, Operating in fast-paced environments","PySpark, Azure ML, Distributed computing, Secure coding, Cross-functional innovation",https://jobright.ai/jobs/info/69868cac8ca8121a3a68da48,https://cw.wd1.myworkdayjobs.com/External/job/Remote-CW-Site---USA---Flexible-United-States/Artificial-Intelligence-Lead--Engineer-_R302368?source=LinkedIn
Deepgram,"Software Engineer, Voice Agents / AI - Deepgram for Restaurants",United States,9 hours ago,N/A,Remote,87.1209,200,4,True,"Cloud infrastructure, AWS, API design, 3rd party API integration, Python, Java, Containerization, Docker, Kubernetes, AI / ML","Backend infrastructure development, Scalable backend systems, High-performance backend systems, Audio processing, Point of Sale systems, Kotlin, Results orientation",https://jobright.ai/jobs/info/69a11e8181476f6176bb764b,https://jobs.ashbyhq.com/Deepgram/4a873ede-8555-42ae-9ddc-ac89afdd7278?source=rLVNdemx1O
Sony Interactive Entertainment,"Software Engineer II (Frontend), Social","San Diego, CA",11 hours ago,$150K/yr - $225K/yr,Onsite,85.7087,200,2,True,"React, React Native, Angular, JavaScript frameworks, Single-page web applications, Cloud-deployed services, API development, Data storage","Mobile development iOS, Mobile development Android, Backend processes, Caching layers, Event buses",https://jobright.ai/jobs/info/69aac617142d5b4265fc1b67,https://job-boards.greenhouse.io/sonyinteractiveentertainmentglobal/jobs/5712556004?gh_src=sgp49gfz4us
"Eccalon, LLC",Full Stack Developer,"Detroit, MI",23 hours ago,N/A,Onsite,92.0992,25,3,True,"React, JavaScript, TypeScript, Node.js, Python, Express.js, Prompt Engineering, Relational Databases, PostgreSQL, NoSQL Databases, DynamoDB, RESTful API Design, Microservices Architecture, AWS Services, Git, CI/CD Pipelines","Full Stack Development, Next.js, Nest.js, LLM API Integration, Retrieval-Augmented Generation (RAG), DevSecOps, NIST 800-171 Compliance, CMMC Compliance",https://jobright.ai/jobs/info/69f69a61b1fc847fc1ae409a,https://recruiting.myapps.paychex.com/appone/MainInfoReq.asp?R_ID=7079382&B_ID=91&fid=1&Adid=0&ssbgcolor=5B5B5B&SearchScreenID=23884&CountryID=3&LanguageID=2
Tektronix,DevOps Engineering Co‑Op (Summer or Fall 2026),"Beaverton, OR",10 hours ago,N/A,Onsite,93.1316,200,N/A,True,"Python, Programming fundamentals, CI/CD concepts","Bash, Source-control workflows",https://jobright.ai/jobs/info/69a89f0679f3f4037f42bd8e,https://ralliant.eightfold.ai/careers/job/1133910911010?domain=ralliant.com&utm_source=linkedin&utm_medium=jobboard
DRW,"Software Engineer, Cumberland/FICCO Tools Engineering","New York, NY",12 hours ago,$175K/yr - $225K/yr,Onsite,85.3266,200,2,True,"Python, Java, C++, Multiple programming languages, Linux-based systems, Concurrent software systems","Financial markets, Delta one store of value, FICC options trading, High-throughput software systems, Low-latency software systems",https://jobright.ai/jobs/info/69154bd09c388539cbdf24a6,https://job-boards.greenhouse.io/drweng/jobs/7392396?gh_src=c25a55fb1us
Bose Corporation,Sr. Data Scientist,"Framingham, MA",6 hours ago,$120K/yr - $165K/yr,Hybrid,78.3563,200,7,True,"Data Science, Machine Learning, AI, Optimization, SQL, Python, Project Management, Strategic Thinking","Supply Chain Modeling, Causal Modeling, Probabilistic Forecasting, Experimental Research Methods, Spark",https://jobright.ai/jobs/info/68ddad01a125e75c422ae185,https://boseallaboutme.wd503.myworkdayjobs.com/Bose_Careers/job/US-MA---Framingham/Sr-Data-Scientist_R28360?source=LinkedIn
Cerebras,Inference Frontend,"Sunnyvale, CA",16 hours ago,N/A,Onsite,98.0,25,N/A,True,"Programming languages, C++",,https://jobright.ai/jobs/info/6984b90b8da7a612045ef8ca,https://boards.greenhouse.io/embed/job_app?token=7619102003&utm_source=jobright
ESB Technologies,Python Developer,United States,10 hours ago,N/A,Remote,83.1942,200,2,True,"Python, SQL","FastAPI, Backend frameworks",https://jobright.ai/jobs/info/69e739ec58811370cb11c242,https://www.linkedin.com/jobs/view/4403941162
Charles Schwab,.NET Developer - Workplace Services Engineering,"Southlake, TX",9 hours ago,$44/hr - $67/hr,Hybrid,84.1325,200,4,True,"RESTful API development, Microservices, Containerization, Docker, Kubernetes, SQL Server, Cloud platforms, AWS, Azure, Cloud-native concepts, CI/CD practices, DevOps tooling, Application security, Performance tuning","C#, NET Core, .NET 6+, ASP.NET Core, Distributed systems, Entity Framework Core, GCP, Agile methodologies, SAFe, SCRUM, Secure coding practices, Monitoring, Google Cloud Associate Cloud Engineer, Google Cloud Professional Cloud Architect, AWS Solutions Architect – Associate, Certified ScrumMaster",https://jobright.ai/jobs/info/69f754e5582f810f9c8cb8db,https://ad.doubleclick.net/ddm/clk/574335155;383638107;m?https://www.schwabjobs.com/job/-/-/33727/92422911488?iis=linkedin_job_wrapping&iisn=rd_linkedin_job_wrapping&utm_source=linkedin.com&utm_medium=job_posting&utm_campaign=Annual_Media&utm_content=social_media&utm_term=383638107&ss=paid
Deloitte,Data Engineer - Project Delivery Analyst,"San Francisco, CA",12 hours ago,$57K/yr - $96K/yr,Onsite,75.3197,57,1,True,"Data pipeline development, Data curation for analytics, SQL, Python, Cloud data engineering - Azure, S3 file formats, DevOps practices, CI/CD, Infrastructure-as-Code - Terraform, Data quality, Metadata, Data governance","Snowflake, PySpark, Cloud data engineering - AWS, Cloud data engineering - GCP, Workflow orchestration, Scheduling - Airflow, Scheduling - MWAA, Scheduling - Step Functions, Scheduling - Glue, Scheduling - ADF, ELT patterns, Lakehouse concepts, Data warehouse concepts, Partitioning, Infrastructure-as-Code - CloudFormation, Data observability",https://jobright.ai/jobs/info/69f644ea81706a5bd216867e,https://apply.deloitte.com/en_US/careers/InviteToApply?jobId=327271&source=LinkedIn
Zoox,AI Developer Productivity Engineer,"Foster City, CA",11 hours ago,$172K/yr - $263K/yr,Onsite,97.1929,200,3,True,"System design, Data structures, Algorithms, Python, C++, LLM evaluation metrics, Performance optimization, Vector databases","Full-stack development, Backend development, Embedding models",https://jobright.ai/jobs/info/667516b259005313f1c81fe3,https://jobs.lever.co/zoox/fe3ec246-6f0a-4405-9ae8-10e322ac6799/apply?source=LinkedIn
Eikon Therapeutics,"Senior Engineer, Data Informatics","Millbrae, CA",9 hours ago,$134K/yr - $146K/yr,Onsite,72.5763,85,3,True,"AI/ML platform integration, Data Lake platform, Software development, Python, Java, JavaScript, SQL, Relational databases, Non-relational databases, Docker, Containerized applications, AWS cloud computing","LIMS software, ELN, Scientific data management, Compound registration, Sample inventory, Instrument data capture, Assay results management, Electronic laboratory notebooks, LIMS application design, Implementation, LIMS software configuration, Tuning, Systems integration, Software requirements documentation, Business process documentation, Computational workflows, Data analysis in life sciences, Life sciences domain knowledge",https://jobright.ai/jobs/info/69a279a0b600907a9628d050,https://job-boards.greenhouse.io/eikontherapeutics/jobs/5061451007?gh_src=0795c4e97us
JPMorganChase,"AI/ML Engineer – Agentic Private Bank Engineer , Vice President","Jersey City, NJ",12 hours ago,$164K/yr - $260K/yr,Onsite,85.7882,85,7,True,"Agentic AI solutions, LLM orchestration, Agentic AI libraries, Python programming, PyTorch, Data pipeline development, Structured data processing, Unstructured data processing, API development, NLP model integration, LLM model integration, Cloud platforms AWS, Cloud platforms Azure, GIT version control, MLOps tools, Prompt engineering, Model training, Model optimization","TensorFlow, Practices, Evaluation",https://jobright.ai/jobs/info/6985fd0e8ca8121a3a682edc,https://JPMorganChase.contacthr.com/150940092
Amazon Web Services (AWS),Software Development Engineer,"Arlington, VA",9 hours ago,$165K/yr - $224K/yr,Onsite,82.8528,193,3,True,"Software Development, Software Design, Design Patterns, Multi-threaded Software Applications, C++, Java, Machine Learning Frameworks, PyTorch, Dynamo, Machine Learning Fundamentals, Large Language Models, Training Lifecycle, Optimization Techniques, Python","Architecture, System Reliability, System Scaling, Large-scale Software Development, Multi-tiered Software Applications, Embedded Software Development, Distributed Software Systems, C#, Perl, JAX, VLLM, SGLang, TorchXLA, TensorRT, Transformer Architecture, Inference Lifecycle",https://jobright.ai/jobs/info/69a07c065218a81676719d5f,https://www.amazon.jobs/jobs/3146673/software-development-engineer?cmpid=SPLICX0248M&utm_source=linkedin.com&utm_campaign=cxro&utm_medium=social_media&utm_content=job_posting&ss=paid
Anything,Mobile Engineer,"San Francisco, CA",10 hours ago,$125K/yr - $200K/yr,Onsite,64.2158,200,N/A,True,"React Native, TypeScript, Programming Fundamentals","Mobile UX Design, Swift, Kotlin, Figma, Empathy, Fearlessness, Curiosity",https://jobright.ai/jobs/info/69615cf7e7ed9a5731ba2359,https://jobs.ashbyhq.com/anything/8784f6aa-4ad9-4651-9439-f3b073f97b43/application?utm_source=ongJb0rM8a
Google,"Software Engineer III, AI/ML GenAI, Search","Mountain View, CA",10 hours ago,$147K/yr - $211K/yr,Onsite,93.7884,125,2,True,"Python, C++, Machine Learning Infrastructure, Model Evaluation, Optimization, Data Processing, Debugging, Generative AI, Large Language Models, Large Vision Models","Model Deployment, Multi-Modal Models, Text Generation, Image Generation, Video Generation, Audio Generation",https://jobright.ai/jobs/info/69a2511fb600907a96289a3b,https://careers.google.com/jobs/results/123496138278871750-software-engineer-iii/?src=Online/LinkedIn/linkedin_us&utm_source=linkedin&utm_medium=jobposting&utm_campaign=contract
